{
  "engagement": {
    "engagementId": "MAB-2026-001",
    "type": "one-off",
    "createdDate": "2026-01-15T00:00:00Z",
    "promoWindow": {
      "daysFromSigning": 30,
      "daysFromLastDeployment": 14,
      "rule": "whichever is later"
    }
  },
  "company": {
    "name": "Apex Abstracts",
    "legalEntity": "Apex Abstracts LLC",
    "industry": "Legal Services",
    "address": {
      "street": "123 Legal Plaza",
      "city": "Austin",
      "state": "TX",
      "zip": "78701"
    },
    "website": "https://apexabstracts.com",
    "logoPath": "https://example.com/logo.png",
    "employeeCount": "12",
    "serviceArea": "Texas"
  },
  "pointOfContact": {
    "name": "Jordan Hale",
    "title": "Founder & CEO",
    "email": "jordan@apexabstracts.com",
    "phone": "512-555-0192",
    "officePhone": "512-555-0100",
    "preferredContactMethod": "email"
  },
  "currentStack": [
    { "category": "CRM", "tool": "HubSpot", "integrationKey": "hubspot" },
    { "category": "Email", "tool": "Google Workspace", "integrationKey": "google-workspace" },
    { "category": "Automation", "tool": "Zapier", "integrationKey": "zapier" }
  ],
  "branding": {
    "useMabBrand": true,
    "clientAccentColor": "#00D4FF",
    "designSystemOptions": ["mab-default"]
  },
  "phases": [
    {
      "phaseId": "foundation",
      "phaseNumber": 1,
      "title": "Foundation Stack",
      "eyebrow": "Current Infrastructure",
      "type": "foundation",
      "narrative": "Audit of existing CRM, email, storage, and payment stack. Identify integration gaps and data hygiene issues. Produce a 90-day automation roadmap.",
      "items": [
        {
          "itemId": "hubspot-audit",
          "name": "HubSpot Health Audit",
          "description": "Full object model review, duplicate detection, pipeline hygiene scoring.",
          "category": "sales",
          "platforms": ["hubspot"],
          "roiMonthly": 1200,
          "hoursSavedMonthly": 8,
          "priceOneTime": 0,
          "priceMonthly": 0,
          "isFulcrum": true,
          "bundle": "foundation-bundle"
        },
        {
          "itemId": "google-workspace-audit",
          "name": "Google Workspace Audit",
          "description": "Shared drive structure, permission audit, calendar optimization.",
          "category": "operations",
          "platforms": ["google-workspace"],
          "roiMonthly": 600,
          "hoursSavedMonthly": 5,
          "priceOneTime": 0,
          "priceMonthly": 0,
          "isFulcrum": false,
          "bundle": "foundation-bundle"
        }
      ],
      "bundles": [
        {
          "bundleId": "foundation-bundle",
          "name": "Foundation Bundle",
          "includes": ["hubspot-audit", "google-workspace-audit"],
          "bundlePrice": 0,
          "savingsVsAlaCarte": 0
        }
      ]
    },
    {
      "phaseId": "automation-menu",
      "phaseNumber": 2,
      "title": "Core Automations",
      "eyebrow": "High-ROI Workflows",
      "type": "automation-menu",
      "narrative": "Deploy 6 core automations that eliminate repetitive work across sales, operations, and finance.",
      "items": [
        {
          "itemId": "lead-enrichment",
          "name": "Lead Enrichment + Routing",
          "description": "Enrich inbound leads with firmographic data and auto-route to correct pipeline.",
          "category": "sales",
          "platforms": ["hubspot", "apollo"],
          "roiMonthly": 1800,
          "hoursSavedMonthly": 12,
          "priceOneTime": 4500,
          "priceMonthly": 0,
          "isFulcrum": true,
          "bundle": "automation-bundle"
        },
        {
          "itemId": "invoice-auto",
          "name": "Invoice Auto-Creation",
          "description": "Generate invoices from closed-won deals and email to client with payment link.",
          "category": "finance",
          "platforms": ["hubspot", "stripe"],
          "roiMonthly": 2200,
          "hoursSavedMonthly": 6,
          "priceOneTime": 3200,
          "priceMonthly": 0,
          "isFulcrum": false,
          "bundle": "automation-bundle"
        }
      ],
      "bundles": [
        {
          "bundleId": "automation-bundle",
          "name": "Automation Bundle",
          "includes": ["lead-enrichment", "invoice-auto"],
          "bundlePrice": 6500,
          "savingsVsAlaCarte": 1200
        }
      ]
    },
    {
      "phaseId": "agent-flows",
      "phaseNumber": 3,
      "title": "Agent Flows",
      "eyebrow": "Autonomous Operators",
      "type": "agent-flows",
      "narrative": "Deploy 3 always-on agents that handle follow-ups, research, and reporting.",
      "items": [
        {
          "itemId": "research-agent",
          "name": "Market Research Agent",
          "description": "Weekly competitive brief + prospect research delivered to Slack.",
          "category": "marketing",
          "platforms": ["hubspot", "openai"],
          "roiMonthly": 950,
          "hoursSavedMonthly": 4,
          "priceOneTime": 0,
          "priceMonthly": 850,
          "isFulcrum": false,
          "bundle": "research-bundle"
        },
        {
          "itemId": "followup-agent",
          "name": "Follow-up Agent",
          "description": "Auto-send personalized follow-ups on open deals >7 days.",
          "category": "sales",
          "platforms": ["hubspot", "gmail"],
          "roiMonthly": 1400,
          "hoursSavedMonthly": 9,
          "priceOneTime": 0,
          "priceMonthly": 950,
          "isFulcrum": true,
          "bundle": "research-bundle"
        }
      ],
      "bundles": []
    },
    {
      "phaseId": "website",
      "phaseNumber": 4,
      "title": "Website + Conversion",
      "eyebrow": "Conversion Infrastructure",
      "type": "website",
      "narrative": "Rebuild site with conversion-optimized pages, embedded proposal CTAs, and analytics.",
      "items": [
        {
          "itemId": "new-site",
          "name": "Conversion Website",
          "description": "7-page site with live ROI calculator, case studies, and gated proposal access.",
          "category": "marketing",
          "platforms": ["webflow", "analytics"],
          "roiMonthly": 0,
          "hoursSavedMonthly": 0,
          "priceOneTime": 18500,
          "priceMonthly": 0,
          "isFulcrum": true,
          "bundle": null
        }
      ],
      "bundles": []
    },
    {
      "phaseId": "expansion",
      "phaseNumber": 5,
      "title": "Expansion Layer",
      "eyebrow": "Future-Proofing",
      "type": "expansion",
      "narrative": "Optional add-ons that compound value as the business scales.",
      "items": [
        {
          "itemId": "crm-migration",
          "name": "Full CRM Migration",
          "description": "Move from legacy CRM to HubSpot with full data migration + training.",
          "category": "sales",
          "platforms": ["hubspot"],
          "roiMonthly": 0,
          "hoursSavedMonthly": 0,
          "priceOneTime": 12500,
          "priceMonthly": 0,
          "isFulcrum": false,
          "bundle": "migration-bundle"
        },
        {
          "itemId": "custom-integration",
          "name": "Custom Integration Build",
          "description": "One-time build of bespoke API integration between any two tools in stack.",
          "category": "operations",
          "platforms": ["api"],
          "roiMonthly": 0,
          "hoursSavedMonthly": 0,
          "priceOneTime": 9800,
          "priceMonthly": 0,
          "isFulcrum": false,
          "bundle": "migration-bundle"
        }
      ],
      "bundles": []
    }
  ],
  "pricing": {
    "discountTiers": [
      { "minItems": 4, "discountPct": 0.15 },
      { "minItems": 8, "discountPct": 0.25 },
      { "minItems": 15, "discountPct": 0.40 }
    ],
    "currency": "USD"
  },
  "painPoints": [
    { "cost": "3-4 hrs/week", "title": "Pipeline Leakage", "description": "Deals fall through cracks because follow-up is manual and inconsistent." },
    { "cost": "2-3 hrs/week", "title": "Invoice Delays", "description": "Finance team spends hours every week manually creating and chasing invoices." },
    { "cost": "4 hrs/week", "title": "Admin Overhead", "description": "Repetitive data entry across CRM, email, and spreadsheets." }
  ],
  "roadmap": [
    { "phaseNum": "1", "title": "Foundation Complete", "weeks": "2", "items": ["hubspot-audit", "google-workspace-audit"] },
    { "phaseNum": "2", "title": "Automations Live", "weeks": "4", "items": ["lead-enrichment", "invoice-auto"] },
    { "phaseNum": "3", "title": "Agents Deployed", "weeks": "6", "items": ["research-agent", "followup-agent"] },
    { "phaseNum": "4", "title": "Website + Agents", "weeks": "12", "items": ["new-site"] }
  ],
  "auth": {
    "method": "magic-link",
    "allowedEmails": ["jordan@apexabstracts.com", "ops@apexabstracts.com"],
    "sessionDurationHours": 720
  },
  "payment": {
    "provider": "stripe",
    "mode": "payment-link",
    "stripePaymentLink": "https://buy.stripe.com/test_abc123",
    "collectRecurring": true
  },
  "integrationsEnabled": ["hubspot", "google-workspace", "zapier"]
}
